{
  "$schema": "http://json-schema.org/draft-07/schema#",
  "title": "Device Architecture Schema",
  "description": "Schema for describing device architecture properties and capabilities",
  "definitions": {
    "Provenance": {
      "type": "string",
      "description": "Where a figure came from. 'Published': the vendor states it in a datasheet, spec sheet, whitepaper or ISA document. 'Derived': it is computed from other figures in this file by an arithmetic the surrounding Description states. 'Measured': it was observed on real hardware by a named benchmark. A figure supported by none of the three is not recorded at all.",
      "enum": ["Published", "Derived", "Measured"]
    },
    "Throughput": {
      "type": "object",
      "description": "One rate figure for ONE unit of the entry that carries it, qualified by the precision and the operating mode it applies to and tagged with its provenance",
      "required": ["Rate", "Unit", "Source"],
      "additionalProperties": false,
      "properties": {
        "Precision": {
          "type": "string",
          "description": "Numeric format the rate applies to. Omit for rates that are precision-independent, such as a link rate or an instruction issue rate",
          "enum": ["FP64", "FP32", "TF32", "BF16", "FP16", "FP8", "BFP8", "BFP4", "BFP2", "INT32", "INT8", "INT4", "Other"]
        },
        "Mode": {
          "type": "string",
          "description": "Operating mode the rate applies to, where one unit has more than one. Vendor-specific by nature, so this is a free string rather than an enum: e.g. 'LoFi', 'HiFi2', 'HiFi4' (Tenstorrent matrix fidelity phases), 'Dense', 'Sparse' (structured sparsity), 'Bidirectional', 'Unidirectional' (links), 'Read', 'Write' (memory ports), 'Fused' (fused instruction issue)"
        },
        "Rate": {
          "type": "number",
          "description": "The figure itself, expressed in Unit. Always read back as a double: it is declared _prop_flt in include/knexus-api/_nxs_propertys.h, so a whole-number literal such as 664 reads back as 664.0 and not as an integer"
        },
        "Unit": {
          "type": "string",
          "description": "Unit of Rate. A closed vocabulary, so two devices' figures are comparable; a figure whose unit is missing here earns a new enum value rather than a free string",
          "enum": ["TFLOP/s", "GFLOP/s", "TOP/s", "GOP/s", "GB/s", "Gb/s", "MAC/cycle", "FLOP/cycle", "OP/cycle", "instruction/cycle", "byte/cycle"]
        },
        "Source": {
          "$ref": "#/definitions/Provenance"
        }
      }
    },
    "Performance": {
      "type": "object",
      "description": "Speeds and feeds of ONE unit of the entry that carries it -- one core, one engine, one link, one instance of that memory. The entry's Count supplies the per-parent multiplier, so chip totals are not restated here. Additive and optional: an entry with no published, derivable or measured figure omits the block rather than guessing one.",
      "minProperties": 1,
      "additionalProperties": false,
      "dependencies": {
        "ClockRate": ["Source"],
        "LaneWidth": ["Source"],
        "TransferRate": ["Source"],
        "Latency": ["Source"]
      },
      "properties": {
        "ClockRate": {
          "type": "number",
          "description": "Clock this unit runs at, in MHz -- and the clock the Throughput figures below are quoted at (e.g. 1350 for Blackhole's 1.35 GHz AI clock, 1980 for an H100 SXM5 boost clock). Always read back as a double: it is declared _prop_flt in include/knexus-api/_nxs_propertys.h, so a whole-number literal such as 1350 reads back as 1350.0 and not as an integer"
        },
        "LaneWidth": {
          "type": "integer",
          "description": "Width in bits of one SIMD lane of this unit (e.g. 32 for the Blackhole SFPU's '32 lanes of 32 bits wide', 64 for a Hopper FP64 core). The lane count is the entry's Size and is not restated here"
        },
        "TransferRate": {
          "type": "number",
          "description": "Signalling rate of this unit's external interface in GT/s -- equivalently Gbps per pin or per lane (e.g. 16 for Blackhole's GDDR6, 5.2 for an MI300X HBM3 stack, 6.4 for LPDDR5 at 6400 MT/s). Multiplied by the bus width in bits and divided by 8 it gives GB/s",
          "exclusiveMinimum": 0
        },
        "Latency": {
          "type": "number",
          "description": "Access latency of this unit in clock cycles (e.g. 2 for the 2-cycle load latency of a Blackhole Private RISC-V Data RAM)",
          "minimum": 0
        },
        "Source": {
          "$ref": "#/definitions/Provenance"
        },
        "Throughput": {
          "type": "array",
          "description": "Rate figures for one unit, one entry per precision and operating mode. An array rather than fixed keys because the set of precisions and modes is open-ended: fixed keys cannot express Tenstorrent's LoFi/HiFi2/HiFi4 fidelity phases or NVIDIA's dense/sparse pairs",
          "minItems": 1,
          "items": {
            "$ref": "#/definitions/Throughput"
          }
        }
      }
    }
  },
  "type": "object",
  "required": ["Name", "Vendor", "Architecture", "ReleaseYear"],
  "properties": {
    "Name": {
      "type": "string",
      "description": "Architecture name (e.g., RDNA 3, Ampere, Ada Lovelace)"
    },
    "Vendor": {
      "type": "string",
      "description": "Manufacturer",
      "enum": ["AMD", "NVIDIA", "Intel", "ARM", "Qualcomm", "Apple", "Other"]
    },
    "Architecture": {
      "type": "string",
      "description": "Architecture target (e.g., gfx942, sm_80)"
    },
    "ReleaseYear": {
      "type": "integer",
      "description": "Year the architecture was first released",
      "minimum": 1990
    },
    "FabricationProcess": {
      "type": "object",
      "description": "Details about the fabrication process",
      "required": ["ProcessNode"],
      "properties": {
        "ProcessNode": {
          "type": "number",
          "description": "Manufacturing process node size in nanometers"
        },
        "Manufacturer": {
          "type": "string",
          "description": "Semiconductor foundry (e.g., TSMC, Samsung, GlobalFoundries)"
        },
        "Technology": {
          "type": "string",
          "description": "Process technology name (e.g., N5, 7LPP)"
        }
      }
    },
    "CoreSubsystem": {
      "type": "object",
      "description": "Information about the Chip Compute Hierarchy",
      "properties": {
        "Name": {
          "type": "string",
          "description": "Vendor-specific name for compute units (e.g., CU, SM, Xe-core)"
        },
        "ChipType": {
          "type": "string",
          "description": "Unit type representing the whole chip (a key in UnitTypes)"
        },
        "CoreType": {
          "type": "string",
          "description": "Unit type representing a single core (a key in UnitTypes, e.g., NeuronCore-v3, Tensix Core)"
        },
        "UnitTypes": {
          "type": "object",
          "description": "Unit types in the compute hierarchy (e.g. chip, CU, SIMD, Tensor Core), keyed by type name",
          "additionalProperties": {
            "type": "object",
            "required": ["Count"],
            "properties": {
              "Count": {
                "type": "integer",
                "description": "Number of these units per parent unit"
              },
              "Size": {
                "type": "integer",
                "default": 1,
                "description": "Number of sub-units inside this unit (e.g. threads). Defaults to 1 when absent"
              },
              "Description": {
                "type": "string",
                "description": "Description of the sub-unit's function"
              },
              "Memory": {
                "type": "array",
                "items": {
                  "type": "string",
                  "description": "Specify memory type embedded in the Core (Lookup in MemorySubsystem)"
                }
              },
              "Subunits": {
                "type": "array",
                "description": "Names of the unit types contained in this unit (each entry is a key in UnitTypes)",
                "items": {
                  "type": "string",
                  "description": "Type name of a contained unit (lookup as a key in UnitTypes)"
                }
              },
              "Performance": {
                "$ref": "#/definitions/Performance"
              }
            }
          }
        }
      }
    },
    "MemorySubsystem": {
      "type": "object",
      "description": "Memory architecture details",
      "properties": {
        "SupportedMemoryTypes": {
          "type": "array",
          "description": "Types of memory supported",
          "items": {
            "type": "string",
            "enum": ["GDDR6", "GDDR6X", "HBM2", "HBM2e", "HBM3", "DDR4", "DDR5", "LPDDR5", "Other"]
          }
        },
        "MemoryTypes": {
          "type": "object",
          "description": "Details about the memory level, including cache, scratch memory and register files, keyed by the memory's short name (e.g., L1, L2, Infinity Cache, VGPR, SGPR, LDS) -- an identifier, not a caption: no parenthetical scope gloss, no '/'. Scope belongs in the entry's description",
          "additionalProperties": {
            "type": "object",
            "properties": {
              "Size": {
                "type": "integer",
                "description": "Size per unit in KB"
              },
              "BankCount": {
                "type": "integer",
                "description": "Number of Banks per unit"
              },
              "MaxMemoryBandwidth": {
                "type": "number",
                "description": "Maximum theoretical memory bandwidth in GB/s"
              },
              "maxBusWidth": {
                "type": "integer",
                "description": "Maximum memory bus width in bits"
              },
              "description": {
                "type": "string",
                "description": "Description of the cache's function"
              },
              "Performance": {
                "$ref": "#/definitions/Performance"
              }
            }
          }
        }
      }
    },
    "KernelModel": {
      "type": "object",
      "description": "Information about supported shader models",
      "properties": {
        "LLVMTarget": {
          "type": "string",
          "description": "LLVM Target architecture"
        },
        "LLVMTriple": {
          "type": "string",
          "description": "LLVM Target triple"
        },
        "LLVMFeatures": {
          "type": "array",
          "description": "LLVM Target triple",
          "items": {
            "type": "object",
            "required": ["Name", "Description"],
            "properties": {
              "Name": {
                "type": "string",
                "description": "Name of the LLVM feature"
              },
              "Description": {
                "type": "string",
                "description": "Description of LLVM feature"
              }
            }
          }
        },
        "Toolchains": {
          "type": "array",
          "description": "Kernel toolchains this device supports: the programming models, SDKs, compilers and shading languages a kernel can be written against, each with its supported version",
          "items": {
            "type": "object",
            "required": ["Type", "Version"],
            "properties": {
              "Type": {
                "type": "string",
                "description": "Name of the toolchain, programming model or shading language (e.g., CUDA, HIP, Metal, OpenCL, PTX ISA, TT-Metalium)"
              },
              "Version": {
                "type": "string",
                "description": "Supported version of that toolchain (e.g., 12.8, 3.1, 0.76.0)"
              }
            }
          }
        }
      }
    },
    "SpecializedHardware": {
      "type": "object",
      "description": "Specialized processing units",
      "properties": {
        "RayTracingAccelerators": {
          "type": "object",
          "description": "Ray tracing hardware details",
          "properties": {
            "Present": {
              "type": "boolean",
              "description": "Whether the architecture has dedicated ray tracing hardware"
            },
            "Name": {
              "type": "string",
              "description": "Vendor-specific name for the RT units"
            },
            "Count": {
              "type": "integer",
              "description": "Number of RT units per compute unit"
            },
            "Performance": {
              "type": "object",
              "description": "Performance metrics",
              "properties": {
                "RaysPerSecond": {
                  "type": "number",
                  "description": "Ray throughput in giga-rays per second"
                }
              }
            }
          }
        },
        "AiAccelerators": {
          "type": "object",
          "description": "AI/ML acceleration hardware",
          "properties": {
            "Present": {
              "type": "boolean",
              "description": "Whether the architecture has dedicated AI hardware"
            },
            "Name": {
              "type": "string",
              "description": "Vendor-specific name for AI units (e.g., Tensor Core, Matrix Engine)"
            },
            "Count": {
              "type": "integer",
              "description": "Number of AI units per compute unit"
            },
            "SupportedPrecisions": {
              "type": "array",
              "description": "Supported numerical precisions",
              "items": {
                "type": "string",
                "enum": ["FP32", "FP16", "BF16", "INT8", "INT4", "Other"]
              }
            },
            "Performance": {
              "type": "object",
              "description": "Performance metrics",
              "properties": {
                "fp16TopsPerGPU": {
                  "type": "number",
                  "description": "Maximum FP16 operations per second in teraops"
                },
                "int8TopsPerGPU": {
                  "type": "number",
                  "description": "Maximum INT8 operations per second in teraops"
                }
              }
            }
          }
        },
        "videoCodecs": {
          "type": "object",
          "description": "Video encode/decode capabilities",
          "properties": {
            "encoders": {
              "type": "array",
              "description": "Supported video encoding formats",
              "items": {
                "type": "object",
                "properties": {
                  "codec": {
                    "type": "string",
                    "enum": ["H.264", "H.265/HEVC", "AV1", "VP9", "Other"]
                  },
                  "maxResolution": {
                    "type": "string",
                    "description": "Maximum supported resolution (e.g., 4K, 8K)"
                  },
                  "maxBitrate": {
                    "type": "integer",
                    "description": "Maximum bitrate in Mbps"
                  },
                  "maxFPS": {
                    "type": "integer",
                    "description": "Maximum frames per second"
                  }
                }
              }
            },
            "decoders": {
              "type": "array",
              "description": "Supported video decoding formats",
              "items": {
                "type": "object",
                "properties": {
                  "codec": {
                    "type": "string",
                    "enum": ["H.264", "H.265/HEVC", "AV1", "VP9", "Other"]
                  },
                  "maxResolution": {
                    "type": "string",
                    "description": "Maximum supported resolution (e.g., 4K, 8K)"
                  },
                  "maxBitrate": {
                    "type": "integer",
                    "description": "Maximum bitrate in Mbps"
                  },
                  "maxFPS": {
                    "type": "integer",
                    "description": "Maximum frames per second"
                  }
                }
              }
            }
          }
        }
      }
    },
    "PowerEfficiency": {
      "type": "object",
      "description": "Power efficiency characteristics",
      "properties": {
        "BaseClock": {
          "type": "integer",
          "description": "Maximum thermal design power in watts"
        },
        "BoostClock": {
          "type": "integer",
          "description": "Maximum thermal design power in watts"
        },
        "MaxTDP": {
          "type": "integer",
          "description": "Maximum thermal design power in watts"
        },
        "PowerStates": {
          "type": "array",
          "description": "Supported power states",
          "items": {
            "type": "object",
            "properties": {
              "Name": {
                "type": "string",
                "description": "Name of the power state"
              },
              "Description": {
                "type": "string",
                "description": "Description of the power state"
              }
            }
          }
        },
        "ClockGating": {
          "type": "boolean",
          "description": "Support for clock gating techniques"
        },
        "DynamicVoltageFrequencyScaling": {
          "type": "boolean",
          "description": "Support for DVFS"
        }
      }
    },
    "PciExpress": {
      "type": "object",
      "description": "PCIe connectivity details",
      "properties": {
        "Version": {
          "type": "string",
          "description": "PCIe version (e.g., 4.0, 5.0)"
        },
        "Lanes": {
          "type": "integer",
          "description": "Maximum PCIe lanes"
        },
        "Bandwidth": {
          "type": "number",
          "description": "Maximum bidirectional bandwidth in GB/s"
        }
      }
    },
    "MultiGpuSupport": {
      "type": "object",
      "description": "Multi-GPU capabilities",
      "properties": {
        "Technologies": {
          "type": "array",
          "description": "Supported multi-GPU technologies",
          "items": {
            "type": "string",
            "enum": ["CrossFire", "SLI", "NVLink", "Infinity Fabric", "None", "Other"]
          }
        },
        "MaxGpus": {
          "type": "integer",
          "description": "Maximum number of supported GPUs in a multi-GPU configuration"
        },
        "InterconnectBandwidth": {
          "type": "number",
          "description": "GPU-to-GPU interconnect bandwidth in GB/s"
        }
      }
    }
  }
}
